{
  "falcon_event_id": "00000014-0000-4000-8000-000000000014",
  "envelope_version": "v1",
  "payload_schema_version": "v1",
  "producer_system_id": "tron",
  "producer_component_id": "tron.execution_engine",
  "evidence_family": "tron.order_submitted",
  "evidence_type": "paper_order_submitted",
  "evidence_class": "EXECUTION",
  "produced_at_utc": "2026-09-28T09:25:13Z",
  "falcon_ingested_at_utc": "2026-09-28T09:25:13Z",
  "subject_id": "broker-ord-778899",
  "instrument_ids": [
    "XAUUSD"
  ],
  "provenance_ref": {
    "producer_system_id": "tron",
    "upstream_ref": "tron:tron.order_submitted:20"
  },
  "payload_hash": "sha256:dd0cd63b4e6f8494ee87eda6d1b765ee2716a52f50c051802e584e3219c5d5e4",
  "retention_class": "standard",
  "sensitivity_class": "internal",
  "payload": {
    "order_intent_id": "tron-intent-0001",
    "broker_order_id": "broker-ord-778899",
    "instrument_id": "XAUUSD",
    "submitted_quantity_decimal": "0.10",
    "submitted_quantity_numeric": 0.1
  },
  "causation_id": "00000013-0000-4000-8000-000000000013"
}
