{
  "falcon_event_id": "00000009-0000-4000-8000-000000000009",
  "envelope_version": "v1",
  "payload_schema_version": "v1",
  "producer_system_id": "ares",
  "producer_component_id": "ares.macro_usd_service",
  "evidence_family": "ares.macro_usd.breadth_state",
  "evidence_type": "usd_breadth_snapshot",
  "evidence_class": "DETERMINISTIC_DERIVATION",
  "produced_at_utc": "2026-09-28T09:10:00Z",
  "falcon_ingested_at_utc": "2026-09-28T09:10:00Z",
  "subject_id": "USD_BREADTH_G10",
  "instrument_ids": [
    "XAUUSD",
    "EURUSD"
  ],
  "provenance_ref": {
    "producer_system_id": "ares",
    "upstream_ref": "ares:ares.macro_usd.breadth_state:9"
  },
  "payload_hash": "sha256:ddfffb3ae0970fec92e32d7cbdc37d7d2fc6b0912472d0ef479576bae688f381",
  "retention_class": "standard",
  "sensitivity_class": "internal",
  "payload": {
    "breadth_measure_id": "ares-usd-breadth-g10-20260928",
    "breadth_state": "STRENGTHENING"
  }
}
