{
  "falcon_event_id": "00000015-0000-4000-8000-000000000015",
  "envelope_version": "v1",
  "payload_schema_version": "v1",
  "producer_system_id": "tron",
  "producer_component_id": "tron.execution_engine",
  "evidence_family": "tron.order_update",
  "evidence_type": "broker_order_update",
  "evidence_class": "EXECUTION",
  "produced_at_utc": "2026-09-28T09:25:14Z",
  "falcon_ingested_at_utc": "2026-09-28T09:25:14Z",
  "subject_id": "broker-ord-778899",
  "instrument_ids": [
    "XAUUSD"
  ],
  "provenance_ref": {
    "producer_system_id": "tron",
    "upstream_ref": "tron:tron.order_update:21"
  },
  "payload_hash": "sha256:e53efc1ba985707a7d92606a1ce406e9acbd1d4b29f37a8149419e94941d0aa7",
  "retention_class": "standard",
  "sensitivity_class": "internal",
  "payload": {
    "broker_order_id": "broker-ord-778899",
    "update_type": "ACKNOWLEDGED"
  },
  "causation_id": "00000014-0000-4000-8000-000000000014"
}
